[
  {
    "id": "SA-2023-AM2-Q01",
    "year": 2023,
    "section": "午前II",
    "question_no": 1,
    "question_text": "システムやソフトウェアの品質に関する主張の正当性を裏付ける文書である“アシュアランスケース”を導入する目的として、適切なものはどれか。",
    "choices": {
      "ア": "システムの構成品目の故障モードに着目してシステムの信頼性を定性的に分析することによって、故障の原因及び影響を明らかにする。",
      "イ": "システムやソフトウェアに関する主張と証拠を示して論理的に説明することによって、目標の品質が達成できることを示す。",
      "ウ": "システムやソフトウェアの振る舞いに対してガイドワードを用いて分析することによって、システムやソフトウェアが意図する振る舞いから逸脱するケースを明らかにする。",
      "エ": "障害とその中間的な原因から基本的な原因までの全てをゲートで関連付けた樹形図で表すことによって、原因又は原因の組合せを明らかにする。"
    },
    "answer": "イ",
    "topic": "アシュアランスケース",
    "category": "設計・実装",
    "source_page": 3,
    "asset_path": null,
    "asset_type": null,
    "source_file": "2023r05h_sa_am2_qs.pdf",
    "audit_status": "source_transcribed_and_answer_checked"
  },
  {
    "id": "SA-2023-AM2-Q02",
    "year": 2023,
    "section": "午前II",
    "question_no": 2,
    "question_text": "図は、階層化されたDFDにおける、あるレベルのDFDの一部である。プロセス1を子プロセスに分割して詳細化したDFDのうち、適切なものはどれか。ここで、プロセス1の子プロセスは、プロセス1-1、1-2及び1-3とする。",
    "choices": {
      "ア": "",
      "イ": "",
      "ウ": "",
      "エ": ""
    },
    "answer": "イ",
    "topic": "階層化DFDのバランシング",
    "category": "設計・実装",
    "source_page": 4,
    "asset_path": "assets/2023_q02_dfd.png",
    "asset_type": "diagram",
    "source_file": "2023r05h_sa_am2_qs.pdf",
    "audit_status": "source_transcribed_and_answer_checked"
  },
  {
    "id": "SA-2023-AM2-Q03",
    "year": 2023,
    "section": "午前II",
    "question_no": 3,
    "question_text": "複数のシステムの組合せによって実現するSoS（System of Systems）をモデル化するのに適した表記法であるSysMLの特徴はどれか。",
    "choices": {
      "ア": "オブジェクト図によって、インスタンスの静的なスナップショットが記述できる。",
      "イ": "単純な図形及び矢印によって、システムのデータの流れが記述できる。",
      "ウ": "パラメトリック図によって、モデル要素間の制約条件が記述できる。",
      "エ": "連接、反復、選択の記述パターンによって、ソフトウェアの構造が分かりやすく視覚化できる。"
    },
    "answer": "ウ",
    "topic": "SysML",
    "category": "設計・実装",
    "source_page": 5,
    "asset_path": null,
    "asset_type": null,
    "source_file": "2023r05h_sa_am2_qs.pdf",
    "audit_status": "source_transcribed_and_answer_checked"
  },
  {
    "id": "SA-2023-AM2-Q04",
    "year": 2023,
    "section": "午前II",
    "question_no": 4,
    "question_text": "ヒューマンインタフェースをもつシステムにおいて、機能とヒューマンインタフェースとの相互依存を弱めることによって、修正性や再利用性を向上させることを目的としたアーキテクチャパターンはどれか。",
    "choices": {
      "ア": "MVC",
      "イ": "イベントシステム",
      "ウ": "マイクロカーネル",
      "エ": "レイヤー"
    },
    "answer": "ア",
    "topic": "MVC",
    "category": "設計・実装",
    "source_page": 5,
    "asset_path": null,
    "asset_type": null,
    "source_file": "2023r05h_sa_am2_qs.pdf",
    "audit_status": "source_transcribed_and_answer_checked"
  },
  {
    "id": "SA-2023-AM2-Q05",
    "year": 2023,
    "section": "午前II",
    "question_no": 5,
    "question_text": "Javaサーブレットを用いたWebアプリケーションソフトウェアの開発では、例えば、doGetやdoPostなどのメソッドを、シグネチャ（メソッド名、引数の型・個数・順序）は変えずに、目的とする機能を実現するための処理に置き換える。このメソッドの置き換えを何と呼ぶか。",
    "choices": {
      "ア": "オーバーライド",
      "イ": "オーバーロード",
      "ウ": "カプセル化",
      "エ": "継承"
    },
    "answer": "ア",
    "topic": "Javaサーブレットのオーバーライド",
    "category": "設計・実装",
    "source_page": 5,
    "asset_path": null,
    "asset_type": null,
    "source_file": "2023r05h_sa_am2_qs.pdf",
    "audit_status": "source_transcribed_and_answer_checked"
  },
  {
    "id": "SA-2023-AM2-Q06",
    "year": 2023,
    "section": "午前II",
    "question_no": 6,
    "question_text": "デザインパターンの説明はどれか。",
    "choices": {
      "ア": "Javaなどのプログラム言語に依存した、コーディングの定石やノウハウを集めたものである。",
      "イ": "再利用性や柔軟性の高いプログラムを設計するために、参考となるオブジェクトの組合せ方をパターンとして分類したものであり、代表的なパターン集としてGoFパターンがある。",
      "ウ": "ソフトウェアの開発方法をパターン集としてまとめたものであり、組織編成や開発管理のためのパターンがある。",
      "エ": "ソフトウェアの基本構造を設計するためのパターンであり、その一つとしてMVCパターンがある。"
    },
    "answer": "イ",
    "topic": "デザインパターン",
    "category": "設計・実装",
    "source_page": 6,
    "asset_path": null,
    "asset_type": null,
    "source_file": "2023r05h_sa_am2_qs.pdf",
    "audit_status": "source_transcribed_and_answer_checked"
  },
  {
    "id": "SA-2023-AM2-Q07",
    "year": 2023,
    "section": "午前II",
    "question_no": 7,
    "question_text": "ある通信販売事業者は、AI技術を利用して人間のように受け答えする、Webのチャットをインタフェースとしたユーザーサポートシステムを開発している。テスト工程では、次の方法でテストする手法を採用した。このような、AIに関するテスト手法を何というか。<br><br>【テストの方法】<br>・判定者は、このシステムと人間との、それぞれを相手に自然言語によるチャットを行う。このとき、判定者はどちらがこのシステムで、どちらが人間なのかは知らされていない。<br>・判定者が一連のチャットを行った後に、チャットの相手のどちらがこのシステムで、どちらが人間かを判別できるかどうかを確認する。",
    "choices": {
      "ア": "実験計画法",
      "イ": "チューリングテスト",
      "ウ": "ファジング",
      "エ": "ロードテスト"
    },
    "answer": "イ",
    "topic": "AIのチューリングテスト",
    "category": "テスト・品質",
    "source_page": 6,
    "asset_path": null,
    "asset_type": null,
    "source_file": "2023r05h_sa_am2_qs.pdf",
    "audit_status": "source_transcribed_and_answer_checked"
  },
  {
    "id": "SA-2023-AM2-Q08",
    "year": 2023,
    "section": "午前II",
    "question_no": 8,
    "question_text": "JIS X 25010:2013（システム及びソフトウェア製品の品質要求及び評価（SQuaRE）―システム及びソフトウェア品質モデル）で定義されたシステム及び／又はソフトウェア製品の品質特性に関する説明のうち、適切なものはどれか。",
    "choices": {
      "ア": "機能適合性とは、明示された状況下で使用するとき、明示的ニーズ及び暗黙のニーズを満足させる機能を、製品又はシステムが提供する度合いのことである。",
      "イ": "信頼性とは、明記された状態（条件）で使用する資源の量に関係する性能の度合いのことである。",
      "ウ": "性能効率性とは、明示された利用状況において、有効性、効率性及び満足性をもって明示された目標を達成するために、明示された利用者が製品又はシステムを利用することができる度合いのことである。",
      "エ": "保守性とは、明示された時間帯で、明示された条件下に、システム、製品又は構成要素が明示された機能を実行する度合いのことである。"
    },
    "answer": "ア",
    "topic": "SQuaRE品質特性",
    "category": "テスト・品質",
    "source_page": 7,
    "asset_path": null,
    "asset_type": null,
    "source_file": "2023r05h_sa_am2_qs.pdf",
    "audit_status": "source_transcribed_and_answer_checked"
  },
  {
    "id": "SA-2023-AM2-Q09",
    "year": 2023,
    "section": "午前II",
    "question_no": 9,
    "question_text": "UML 2.0のステートマシン図の記法に適合している図はどれか。",
    "choices": {
      "ア": "",
      "イ": "",
      "ウ": "",
      "エ": ""
    },
    "answer": "ア",
    "topic": "UMLステートマシン図",
    "category": "設計・実装",
    "source_page": 8,
    "asset_path": "assets/2023_q09_uml.png",
    "asset_type": "diagram",
    "source_file": "2023r05h_sa_am2_qs.pdf",
    "audit_status": "source_transcribed_and_answer_checked"
  },
  {
    "id": "SA-2023-AM2-Q10",
    "year": 2023,
    "section": "午前II",
    "question_no": 10,
    "question_text": "タイピングを行う人をドライバと呼び、その様子を見ながら指摘や助言をする人をナビゲータと呼んで、2人が1台のPCを共有して共同でプログラムを作成する技法はどれか。",
    "choices": {
      "ア": "インスペクション",
      "イ": "ウォークスルー",
      "ウ": "パスアラウンド",
      "エ": "ペアプログラミング"
    },
    "answer": "エ",
    "topic": "ペアプログラミング",
    "category": "設計・実装",
    "source_page": 9,
    "asset_path": null,
    "asset_type": null,
    "source_file": "2023r05h_sa_am2_qs.pdf",
    "audit_status": "source_transcribed_and_answer_checked"
  },
  {
    "id": "SA-2023-AM2-Q11",
    "year": 2023,
    "section": "午前II",
    "question_no": 11,
    "question_text": "JIS X 0160:2021（ソフトウェアライフサイクルプロセス）によれば、ソフトウェアライフサイクルプロセスにおいて、提供するソフトウェアシステムが利害関係者要件（要求事項）に合致し、利用に適していることを、顧客とともに確信するに至るためのテストを何と呼ぶか。",
    "choices": {
      "ア": "ソフトウェア受入れテスト",
      "イ": "ソフトウェア検証",
      "ウ": "ソフトウェア適格性確認テスト",
      "エ": "ファズテスト"
    },
    "answer": "ア",
    "topic": "ソフトウェア受入れテスト",
    "category": "要求・開発プロセス",
    "source_page": 9,
    "asset_path": null,
    "asset_type": null,
    "source_file": "2023r05h_sa_am2_qs.pdf",
    "audit_status": "source_transcribed_and_answer_checked"
  },
  {
    "id": "SA-2023-AM2-Q12",
    "year": 2023,
    "section": "午前II",
    "question_no": 12,
    "question_text": "スクラムを適用したアジャイル開発において、スクラムチームで、人、関係、プロセス及びツールの観点から、何がうまくいき、何がうまくいかなかったのかを議論し、プロセス改善を促進するアクティビティはどれか。",
    "choices": {
      "ア": "スプリントレトロスペクティブ",
      "イ": "スプリントレビュー",
      "ウ": "デイリースクラム",
      "エ": "バックログリファインメント"
    },
    "answer": "ア",
    "topic": "スクラムのレトロスペクティブ",
    "category": "マネジメント・契約",
    "source_page": 9,
    "asset_path": null,
    "asset_type": null,
    "source_file": "2023r05h_sa_am2_qs.pdf",
    "audit_status": "source_transcribed_and_answer_checked"
  },
  {
    "id": "SA-2023-AM2-Q13",
    "year": 2023,
    "section": "午前II",
    "question_no": 13,
    "question_text": "製品Xと製品Yを販売している企業が、見積作成と提案書作成に掛かる業務時間を、それぞれ20%削減できるシステムの構築を検討している。Activity-Based Costingを用いて、次の条件が洗い出された。本システム構築による製品Xの見積作成と製品Xの提案書作成に関する月間総人件費削減効果は幾らか。<br><br>【条件】<br>・製品Xの見積作成に掛かる月間業務時間は、50時間<br>・製品Xの提案書作成に掛かる月間業務時間は、50時間<br>・製品Yの見積作成に掛かる月間業務時間は、100時間<br>・製品Yの提案書作成に掛かる月間業務時間は、400時間<br>・製品Xと製品Yの見積作成に掛かる月間総人件費は、60万円<br>・製品Xと製品Yの提案書作成に掛かる月間総人件費は、360万円<br>・見積作成と提案書作成は、それぞれ人件費単価が異なる部門が担っている<br>・製品Xと製品Yの見積作成に掛かる人件費単価は、同じである<br>・製品Xと製品Yの提案書作成に掛かる人件費単価は、同じである",
    "choices": {
      "ア": "4万円",
      "イ": "8万円",
      "ウ": "12万円",
      "エ": "14万円"
    },
    "answer": "ウ",
    "topic": "ABCによる人件費削減効果",
    "category": "マネジメント・契約",
    "source_page": 10,
    "asset_path": null,
    "asset_type": null,
    "source_file": "2023r05h_sa_am2_qs.pdf",
    "audit_status": "source_transcribed_and_answer_checked"
  },
  {
    "id": "SA-2023-AM2-Q14",
    "year": 2023,
    "section": "午前II",
    "question_no": 14,
    "question_text": "WTO政府調達協定の説明はどれか。",
    "choices": {
      "ア": "EU市場で扱われる電気・電子製品、医療機器などにおいて、一定基準値を超える特定有害物質（鉛、カドミウム、六価クロム、水銀など6物質）の使用を規制することを定めたものである。",
      "イ": "国などの公的機関が率先して、環境物品等（環境負荷低減に資する製品やサービス）の調達を推進し、環境物品等への需要の転換を促進するために必要な事項を定めたものである。",
      "ウ": "政府機関などによる物品・サービスの調達において、締約国に対する市場開放を進めて国際的な競争の機会を増大させるとともに、苦情申立て、協議及び紛争解決に関する実効的な手続を定めたものである。",
      "エ": "締約国に対して、工業所有権の保護に関するパリ条約や、著作権の保護に関するベルヌ条約などの主要条項を遵守することを義務付けるとともに、知的財産権保護のための最恵国待遇などを定めたものである。"
    },
    "answer": "ウ",
    "topic": "WTO政府調達協定",
    "category": "マネジメント・契約",
    "source_page": 11,
    "asset_path": null,
    "asset_type": null,
    "source_file": "2023r05h_sa_am2_qs.pdf",
    "audit_status": "source_transcribed_and_answer_checked"
  },
  {
    "id": "SA-2023-AM2-Q15",
    "year": 2023,
    "section": "午前II",
    "question_no": 15,
    "question_text": "システム開発における発注者と受注者であるベンダーとの契約方法のうち、実費償還契約はどれか。",
    "choices": {
      "ア": "委託業務の進行中に発生するリスクはベンダーが負い、発注者は注文時に合意した価格を支払う。",
      "イ": "インフレ率や特定の製品の調達コストの変化に応じて、あらかじめ取り決められた契約金額を調整する。",
      "ウ": "契約時に、目標とするコスト、利益、利益配分率、上限額を合意し、目標とするコストと実際に発生したコストの差異に基づいて利益を配分する。",